comment,code,non-information
Check if we are supposed to set a character format for citations:,boolean mustTestCharFormat = style.isFormatCitations();,no
css:arrow-up-bold *,"MOVE_TAB_ARROW(MaterialDesignIcon.ARROW_UP_BOLD),",yes
"TODO: reflective access, should be removed","Field privateStringField = TableView.class.getDeclaredField(""contentWidth"");",no
Creates a column for DOIs or URLs. The {@code firstField} is preferred to be shown over {@code secondField}.,"private TableColumn<BibEntryTableViewModel, Field> createUrlOrDoiColumn(JabRefIcon icon, Field firstField, Field secondField) {",no
Get the comparator to order the suggestions,protected abstract Comparator<T> getComparator();,no
Check if there are empty keys,boolean emptyKeys = false;,yes
Repeat for individual file dir - reuse 'text' and 'dir' vars,text = viewModel.userSpecificFileDirectoryProperty().getValue();,no
alt on win,"LOGGER.debug(""Node LINK"");",no
Represents the view model for a page in the document viewer.,public abstract class DocumentPageViewModel {,yes
Menu to show up on right-click in a text field for converting text formats,class ConversionMenu extends Menu {,no
"This is ugly but we have no proper update mechanism in place to propagate the changes, so redraw everything",refresh();,no
"TODO: Print error message Localization.lang(""PDF does not exist"");",} else {,no
Prints parsing statistics,public String getInformation(boolean includeMissingEntries) {,no
Calls the {@link AbbreviationsFileViewModel#writeOrCreate()} method for each file in the journalFiles property which will overwrite the existing files with the content of the abbreviations property of the AbbriviationsFile. Non existing files will be created.,public void saveJournalAbbreviationFiles() {,no
Sets the {@link Consumer} that is invoked after the task is successfully finished. The consumer always runs on the JavaFX thread.,public BackgroundTask<V> onSuccess(Consumer<V> onSuccess) {,no
"Copyright (c) 2014, 2016 ControlsFX All rights reserved. Redistribution and use in source and binary forms, with or without modification, are permitted provided that the following conditions are met: * Redistributions of source code must retain the above copyright notice, this list of conditions and the following disclaimer. * Redistributions in binary form must reproduce the above copyright notice, this list of conditions and the following disclaimer in the documentation and/or other materials provided with the distribution. * Neither the name of ControlsFX, any associated website, nor the names of its contributors may be used to endorse or promote products derived from this software without specific prior written permission. THIS SOFTWARE IS PROVIDED BY THE COPYRIGHT HOLDERS AND CONTRIBUTORS ""AS IS"" AND ANY EXPRESS OR IMPLIED WARRANTIES, INCLUDING, BUT NOT LIMITED TO, THE IMPLIED WARRANTIES OF MERCHANTABILITY AND FITNESS FOR A PARTICULAR PURPOSE ARE DISCLAIMED. IN NO EVENT SHALL CONTROLSFX BE LIABLE FOR ANY DIRECT, INDIRECT, INCIDENTAL, SPECIAL, EXEMPLARY, OR CONSEQUENTIAL DAMAGES (INCLUDING, BUT NOT LIMITED TO, PROCUREMENT OF SUBSTITUTE GOODS OR SERVICES; LOSS OF USE, DATA, OR PROFITS; OR BUSINESS INTERRUPTION) HOWEVER CAUSED AND ON ANY THEORY OF LIABILITY, WHETHER IN CONTRACT, STRICT LIABILITY, OR TORT (INCLUDING NEGLIGENCE OR OTHERWISE) ARISING IN ANY WAY OUT OF THE USE OF THIS SOFTWARE, EVEN IF ADVISED OF THE POSSIBILITY OF SUCH DAMAGE.",package org.jabref.gui.autocompleter;,no
Extract destination URL,try {,no
Updates the view to reflect changes to visible components.,private void updateView() {,yes
"This class represents a change in any field value. The relevant information is the BibEntry, the field name, the old and the new value. Old/new values can be null.",public class UndoableFieldChange extends AbstractUndoableJabRefEdit {,no
Abstract class for pushing entries into different editors.,public abstract class AbstractPushToApplication implements PushToApplication {,no
put the warning into as exception text -> it will be displayed to the user,,no
"This wraps the old Swing commands so that they fit into the new infrastructure. In the long term, this class should be removed.",@Deprecated,no
The default context menu with a specific menu item to cleanup URL.,public static Supplier<List<MenuItem>> getCleanupURLMenu(TextArea textArea) {,no
"icon is chosen based on field name in cell, so map fields to its names",column.setCellValueFactory(cellData -> EasyBind.monadic(cellData.getValue().getField(firstField)).map(x -> firstField).orElse(EasyBind.monadic(cellData.getValue().getField(secondField)).map(x -> secondField)));,no
Execute command,try {,no
Ignored,return Collections.emptyList();,no
Returns true if there is an external file type registered for this extension.,public boolean isExternalFileTypeByExt(String extension) {,no
"unknown, cannot un/abbreviate anything",return false;,yes
vim:set shiftwidth=4 softtabstop=4 expandtab:,,no
Redo the change.,try {,no
"We need to get the tab header, the following is a ugly workaround",Node tabHeaderArea = ((TabPaneSkin) this.tabbedPane.getSkin()),no
reset all fields,for (TextField field : textFields.values()) {,yes
Similar to {@link org.fxmisc.easybind.monadic.MonadicObservableValue},public class OptionalObjectProperty<T> extends SimpleObjectProperty<Optional<T>> {,no
,"public static void showContextMenu(TextField textField, ContextMenu contextMenu, ContextMenuEvent e) {",no
css: clipboard-arrow-left *,EXPORT_TO_CLIPBOARD(MaterialDesignIcon.CLIPBOARD_ARROW_LEFT),yes
TODO: Replace by http://docs.oracle.com/javase/7/docs/api/java/awt/Desktop.html http://stackoverflow.com/questions/18004150/desktop-api-is-not-supported-on-the-current-platform,public class JabRefDesktop {,no
Executes a callable task that provides a return value after the calculation is done. @param command The task to execute. @return A Future object that provides the returning value.,public <T> Future<T> execute(Callable<T> command) {,yes
Need to run this on the JavaFX thread,"JabRefGUI.getMainFrame().addParserResult(pr, focusPanel)",no
set original filename (again),tabbedPane.getTabs().get(i).setText(getBasePanelAt(i).getTabTitle());,no
"If required, check that all entries have BibTeX keys defined:",if (application.requiresBibtexKeys()) {,no
"Check if the value returned by getColumnValue() is the same as a simple check of the entry's field(s) would give The reasons for being different are (combinations may also happen): - The entry has a crossref where the field content is obtained from - The field has a string in it (which getColumnValue() resolves) - There are some alias fields. For example, if the entry has a date field but no year field, {@link BibEntry#getResolvedFieldOrAlias(String, BibDatabase)} will return the year value from the date field when queried for year",public boolean isResolved(BibEntry entry) {,no
TODO imlement default,},no
Use default key bindings,for (KeyBinding keyBinding : KeyBinding.values()) {,yes
Store shown columns and their width in preferences.,private void updateColumnPreferences() {,no
"TODO: Add undo final UndoableAddOrRemoveGroup undo = new UndoableAddOrRemoveGroup(groupsRoot, node, UndoableAddOrRemoveGroup.REMOVE_NODE_KEEP_CHILDREN); panel.getUndoManager().addEdit(undo);",GroupTreeNode groupNode = group.getGroupNode();,no
Read all saved file paths and read their abbreviations,public void createFileObjects() {,no
"On Linux, Java FX fonts look blurry per default. This can be improved by using a non-default rendering setting. See https://github.com/woky/javafx-hates-linux",if (Globals.prefs.getBoolean(JabRefPreferences.FX_FONT_RENDERING_TWEAK)) {,no
Runs the specified {@link Runnable} on the JavaFX application thread and waits for completion.,public static void runAndWaitInJavaFXThread(Runnable action) {,yes
JabRef MainClass,public class JabRefMain extends Application {,yes
Bootstraps the component context from a UNO installation.,"public static final XComponentContext bootstrap(String[] argArray, URLClassLoader loader) throws BootstrapException {",no
"if (!Globals.prefs.isKeywordSyncEnabled()) { return; }final BibEntry entry = event.getBibEntry(); // NamedCompount code similar to SpecialFieldUpdateListener NamedCompound nc = new NamedCompound(Localization.lang(""Synchronized special fields based on keywords"")); List<FieldChange> changes = SpecialFieldsUtils.syncSpecialFieldsFromKeywords(entry, Globals.prefs.getKeywordDelimiter()); for (FieldChange change: changes) { nc.addEdit(new UndoableFieldChange(change)); } // Don't insert the compound into the undoManager, // it would be added before the component which undoes the insertion of the entry and creates heavy problems // (which prohibits the undo the deleting multiple entries)",},no
Get target folder,Optional<Path> fileDir = databaseContext.getFirstExistingFileDir(filePreferences);,no
"Ctrl on Windows, no modifier on Xubuntu","LOGGER.debug(""Mode COPY"");",no
default command,"String cmd = ""xdg-open "" + filePath.toAbsolutePath().getParent().toString();",no
Reloads the JabRefPreferences into the UI,private void updateAfterPreferenceChanges() {,no
"We define two file type objects as equal if their name, extension, openWith and iconName are equal.",@Override,no
Create buttons,"ButtonType replaceEntries = new ButtonType(Localization.lang(""Merge entries""), ButtonBar.ButtonData.OK_DONE);",yes
Time stamp,,no
"This class can be used to wrap an @see ObservableList inside it. When wrapped, any Listener listening for updates to the wrapped ObservableList (for example because of a binding to it) is ensured to be notified on the JavaFX Application Thread. It should be used to implement bindings where updates come in from a background thread but should be reflected in the UI where it is necessary that changes to the UI are performed on the JavaFX Application thread.",public class UiThreadObservableList<E> implements ObservableList<E> {,no
Executes a collection of callable tasks and returns a List of the resulting Future objects after the calculation is done. @param tasks The tasks to execute @return A List of Future objects that provide the returning values.,public <T> List<Future<T>> executeAll(Collection<Callable<T>> tasks) {,yes
This will set the {@code currentFile} property to the {@link AbbreviationsFileViewModel} object that was added to the {@code journalFiles} list property lastly. If there are no files in the list property this methode will do nothing as the {@code currentFile} property is already {@code null}.,public void selectLastJournalFile() {,no
Method to delete the abbreviation set in the currentAbbreviation property. The currentAbbreviationProperty will be set to the previous or next abbreviation in the abbreviations property if applicable. Else it will be set to {@code null} if there are no abbreviations left.,public void deleteAbbreviation() {,no
We need to sort the reference marks according to their order of appearance:,names = sortedReferenceMarks;,no
Returns a wrapper around the given list that posts changes on the JavaFX thread.,public static <T> ObservableList<T> forUI(ObservableList<T> list) {,no
kill the remote thread,stopRemoteThread();,yes
"First try xmp import, if empty try pdf import, otherwise create empty entry",if (!xmpEntriesInFile.isEmpty()) {,no
Revert the change.,base.removeString(string.getId());,no
"Go through unchanged types. Remove them from the ones that should be stored, and from the list of defaults, since we don't need to mention these in prefs:",for (ExternalFileType type : unchanged) {,no
Checks if all tabs are valid ToDo: After conversion of all tabs use mvvmfx-validator ToDo: should be observable for binding of OK-button in View,,no
Next add all the visible tabs (if not already present) at the right position,for (int i = 0; i < visibleTabs.size(); i++) {,no
update all tab titles,updateAllTabTitles();,yes
Helper class to create and style controls according to an {@link Action}.,public class ActionFactory {,no
Class for fetching and merging bibliographic information,public class FetchAndMergeEntry {,yes
paranoia: ensure that there are never two instances of AllEntriesGroup,if (newGroups.getGroup() instanceof AllEntriesGroup) {,no
Create button that triggers search,"Button search = new Button(Localization.lang(""Search""));",yes
"Activate context menu if user presses the ""context menu"" key","tableView.addEventHandler(KeyEvent.KEY_RELEASED, event -> {",no
,public static <V> V runInJavaFXThread(Callable<V> callable) {,yes
Add the edit field for Bibtex-key.,fields.add(InternalField.KEY_FIELD);,no
Remove all reference marks that don't look like JabRef citations:,List<String> tmp = new ArrayList<>();,no
"Although entries are redefined without use, this also updates linkSourceBase","Map<BibEntry, BibDatabase> entries = findCitedEntries(databases, cited, linkSourceBase);",no
"for the remaining entries, intersection has to be used this approach ensures that one empty keyword list leads to an empty set of common keywords",for (BibEntry entry : entries) {,no
A very simple implementation of the {@link TaskExecutor} interface. Every submitted task is invoked in a separate thread.,public class DefaultTaskExecutor implements TaskExecutor {,no
all buttons in base dialogs react on enter,if (event.getCode() == KeyCode.ENTER) {,no
... but not for this entry.,refKeys.get(marker).add(currentKey);,no
"If we found it, remove it from the type list:",if (toRemove != null) {,yes
The main window of the application.,public class JabRefFrame extends BorderPane {,no
Redo the change.,try {,no
Tools for automatically detecting OpenOffice or LibreOffice installations.,public class DetectOpenOfficeInstallation {,no
"Heuristic missed, so try to get page number from first shown page",currentPage.set(,no
Assuming the current page is A4 (or has same aspect ratio),setPageWidth(desiredPageDimension.getWidth(Math.sqrt(2)) + delta);,no
Check if there are two entries selected,List<BibEntry> selectedEntries = basePanel.getSelectedEntries();,yes
This class controls the user interface of the journal abbreviations dialog. The ui elements and their layout are defined in the fxml file.,public class ManageJournalAbbreviationsView extends BaseDialog<Void> {,no
only add tab if DB is not already open,Optional<BasePanel> panel = getBasePanelList().stream(),no
This class represents the change of type for an entry.,public class UndoableChangeType extends AbstractUndoableJabRefEdit {,no
General,,no
Sets the title of the main window.,public void setWindowTitle() {,no
check mode of currently used DB,if (panel != null) {,no
No parent = root -> just add,this.moveTo(target);,no
"write the entries using sw, which is used later to form the email content",BibEntryWriter bibtexEntryWriter = new BibEntryWriter(,no
"Opens the given files. If one of it is null or 404, nothing happens","public void openFiles(List<Path> filesToOpen, boolean raisePanel) {",no
Ask for consent to send data to Mr. DLib on first time to tab,if (preferences.isMrdlibAccepted()) {,no
Only the first of the extensions gotten from FileType is saved into the class using get(0),String extensionString = exporter.getFileType().getExtensions().get(0);,no
The path to the edited subtree's root node,private final List<Integer> m_pathToNode;,no
Up to version 2.4b the mime type is not included:,"mimeType = """";",no
"ApplicationInsights-Java Copyright (c) Microsoft Corporation All rights reserved.MIT License Permission is hereby granted, free of charge, to any person obtaining a copy of this software and associated documentation files (the """"Software""""), to deal in the Software without restriction, including without limitation the rights to use, copy, modify, merge, publish, distribute, sublicense, and/or sell copies of the Software, and to permit persons to whom the Software is furnished to do so, subject to the following conditions: The above copyright notice and this permission notice shall be included in all copies or substantial portions of the Software. THE SOFTWARE IS PROVIDED *AS IS*, WITHOUT WARRANTY OF ANY KIND, EXPRESS OR IMPLIED, INCLUDING BUT NOT LIMITED TO THE WARRANTIES OF MERCHANTABILITY, FITNESS FOR A PARTICULAR PURPOSE AND NONINFRINGEMENT. IN NO EVENT SHALL THE AUTHORS OR COPYRIGHT HOLDERS BE LIABLE FOR ANY CLAIM, DAMAGES OR OTHER LIABILITY, WHETHER IN AN ACTION OF CONTRACT, TORT OR OTHERWISE, ARISING FROM, OUT OF OR IN CONNECTION WITH THE SOFTWARE OR THE USE OR OTHER DEALINGS IN THE SOFTWARE.",,no
"On Windows, store application as empty if the ""Default"" option is selected, or if the application name is empty:",if (defaultApplicationSelectedProperty.getValue() || application.isEmpty()) {,no
"Creates a list of all files (leaf nodes in the tree structure), which have been selected.",private List<Path> getFileListFromNode(CheckBoxTreeItem<FileNodeWrapper> node) {,no
css: server-plus*,ADD_ROW(MaterialDesignIcon.SERVER_PLUS),yes
This method returns the enum constant value,public String getConstant() {,yes
Copies the doi url to the clipboard,public class CopyDoiUrlAction extends SimpleCommand {,no
Update type label,"TypedBibEntry typedEntry = new TypedBibEntry(entry, databaseContext.getMode());",no
Update key list to match the new sorting:,for (int j = 0; j < cEntries.length; j++) {,no
Runs the given task and returns a Future representing that task.,<V> Future<V> execute(BackgroundTask<V> task);,yes
Alt on Windows,"LOGGER.debug(""Mode LINK"");",no
Runs the cleanup on the entry and records the change.,"private void doCleanup(CleanupPreset preset, BibEntry entry, NamedCompound ce) {",no
"This action can be invoked without an open database, so we have to check if we have one before trying to invoke methods to execute changes in the preferences.",,no
"Set up the list of external file types, either from default values, or from values recorded in Preferences.",private void updateExternalFileTypes() {,no
Notifies the tab that it got focus and should display the given entry.,public void notifyAboutFocus(BibEntry entry) {,no
handled by FX in TextInputControl#paste,break;,no
"File doesn't exist, so we can't move it.","dialogService.showErrorDialogAndWait(Localization.lang(""File not found""), Localization.lang(""Could not find file '%0'."", linkedFile.getLink()));",yes
"Opens ""Edit Group Dialog"" and changes the given group to the edited one.",public void editGroup(GroupNodeViewModel oldGroup) {,no
"We can't watch files directly, so monitor their parent directory for updates",Path directory = file.toAbsolutePath().getParent();,no
Extract the list of bibtex keys from a reference mark name.,public List<String> parseRefMarkName(String name) {,no
leave the expansion state of the tree item as it is,this.draggedItem.setExpanded(this.draggedItem.isExpanded());,no
Display link to expand text,if (!this.getChildren().contains(moreLink)) {,no
Start looking at changes.,"BibDatabaseDiff differences = BibDatabaseDiff.compare(referenceDatabase, databaseOnDisk);",no
"change root group, even though it'll be AllEntries anyway",root.setGroup(changedGroups.getGroup());,no
"When mime type is included, the array length should be 5:",mimeType = val[2];,no
Loop through the available databases,for (BibDatabase loopDatabase : databases) {,yes
Replace both entries by merged entry,entries.add(diag.getMergedEntry());,no
if (value==null) and then call nullField has been omitted as updatefield also handles value==null,"List<FieldChange> changes = SpecialFieldsUtils.updateField(specialField, value, be, nullFieldIfValueIsTheSame, Globals.prefs.isKeywordSyncEnabled(), Globals.prefs.getKeywordDelimiter());",no
storing a backup of the whole subtree is not required when children are kept,m_subtreeBackup = editType != UndoableAddOrRemoveGroup.REMOVE_NODE_KEEP_CHILDREN ? editedNode.getNode(),no
Inserts each citation into a HTML body and copies it to the clipboard,protected static ClipboardContent processHtml(List<String> citations) {,no
Only one linked file -> open directly,"LinkedFileViewModel linkedFileViewModel = new LinkedFileViewModel(linkedFiles.get(0), entry.getEntry(), database, Globals.TASK_EXECUTOR, dialogService, Globals.prefs.getXMPPreferences(), Globals.prefs.getFilePreferences(), externalFileTypes);",no
"If not, start GUI","new JabRefGUI(mainStage, argumentProcessor.getParserResults(), argumentProcessor.isBlank());",yes
empty,},yes
"After adding the databases, go through each and see if any post open actions need to be done. For instance, checking if we found new entry types that can be imported, or checking if the database contents should be modified due to new features in this version of JabRef. Note that we have to check whether i does not go over getBasePanelCount(). This is because importToOpen might have been used, which adds to loadedDatabases, but not to getBasePanelCount()",,no
New ZIP file chooser.,public ZipFileChooser(FileSystem zipFile) throws IOException {,yes
expand node and all children on drag over,dragExpansionHandler.expandGroup(row.getTreeItem());,yes
TODO: merge with import,"factory.createMenuItem(StandardActions.MERGE_DATABASE, new OldDatabaseCommandWrapper(Actions.MERGE_DATABASE, this, stateManager)),",no
css: code-equal *,"FIND_DUPLICATES(MaterialDesignIcon.CODE_EQUAL),",yes
Find entries in clipboard,List<BibEntry> entriesToAdd = Globals.clipboardManager.extractData();,yes
Access the Child_Section's XTextContent interface and insert it into the document,"XTextContent xChildSection = UnoRuntime.queryInterface(XTextContent.class, xChildNamed);",no
Set the visibility of the progress bar in the right end of the status line at the bottom of the frame.,public void setProgressBarVisible(final boolean visible) {,no
Converts a path relative to a base-path into a class name.,"private static String pathToClass(String basePath, Path path) {",no
"The following is necesary to initiate the drag and drop in javafx, although we don't need the contents It doesn't work without",ClipboardContent content = new ClipboardContent();,no
"(maskText(""A"") != ""A"");",boolean maskText = (textInputControl instanceof PasswordField);,no
Use the correct viewer even if pdf and ps are mixed up:,"String[] split = file.get().getFileName().toString().split(""\\."");",no
"This interface defines potential actions that may need to be taken after opening a BIB file into JabRef. This can for instance be file upgrade actions that should be offered due to new features in JabRef, and may depend on e.g. which JabRef version the file was last written by. This interface is introduced in an attempt to add such functionality in a flexible manner.",public interface GUIPostOpenAction {,no
Warning before overwriting is only relevant if overwriting can happen:,warnBeforeOverwriting.setDisable(dontOverwrite.isSelected());,no
TODO: Remove this copy as soon as the one included in AI is compatible with log4j 3,public final class ApplicationInsightsLogEvent extends ApplicationInsightsEvent {,no
insert the connector,"xSet.insert(xImpLoader.activate(""com.sun.star.comp.connections.Connector"", null, null, null));",yes
"As there is no concept like an empty node/icon, we return simply the other icon",return JabRefIcons.GROUP_INTERSECTION.getGraphicNode();,no
Add all bibDatabases databases to the frame:,boolean first = false;,no
This is a simple implementation of a generic suggestion provider callback. The complexity of suggestion generation is O(n) where n is the number of possible suggestions.,"public abstract class SuggestionProvider<T> implements Callback<ISuggestionRequest, Collection<T>> {",no
"Returns a newer version excluding any non-stable versions, except if the installed one is unstable too. If no newer version was found, then an empty optional is returned.",private Optional<Version> getNewVersion() throws IOException {,no
Prints the connection problem to the status bar and shows a dialog if it was executed manually,"private void showConnectionError(Exception exception, boolean manualExecution) {",no
css: file-powerpoint *,"FILE_POWERPOINT(MaterialDesignIcon.FILE_POWERPOINT),",yes
Detect Google search URL,"private static final String GOOGLE_SEARCH_EXP = ""^https?://(?:www\\.)?google\\.[\\.a-z]+?/url.*"";",yes
update keywords,keywords.removeAll(keywordsToRemove);,yes
css: auto-fix*,"AUTO_GROUP(MaterialDesignIcon.AUTO_FIX),",yes
Bootstraps the initial component context from a native UNO installation. See also <code>cppuhelper/defaultBootstrap_InitialComponentContext()</code>.,"public static final XComponentContext defaultBootstrap_InitialComponentContext(String ini_file, Map<String, String> bootstrap_parameters) throws Exception {",no
css: twitter *,"TWITTER(MaterialDesignIcon.TWITTER),",yes
Drag and drop support,row.setOnDragDetected(event -> {,no
"File on disk has changed, thus look for notable changes and notify listeners in case there are such changes","ChangeScanner scanner = new ChangeScanner(database, referenceFile);",no
"Append a given value to a given field for all entries in a Collection. This method DOES NOT update any UndoManager, but returns a relevant CompoundEdit that should be registered by the caller.","private static UndoableEdit massAppendField(Collection<BibEntry> entries, Field field, String textToAppend) {",no
We have to use reflection to get the associated label,try {,no
"... if so, mark base changed. Prevent the Undo button from removing change marking:",if (changed) {,no
passed file (we take the first one) should be focused,String focusedFile = bibDatabases.stream(),no
"Decides if the content stored in the given {@link Dragboard} can be droped on the given target row. Currently, the following sources are allowed: - another group (will be added as subgroup on drop) - entries if the group implements {@link GroupEntryChanger} (will be assigned to group on drop)",public boolean acceptableDrop(Dragboard dragboard) {,no
The string was removed or renamed locally. We guess that it was removed.,"BibtexString bs = new BibtexString(label, disk);",no
